<?xml version="1.0" encoding="UTF-8"?>
<xs:schema xmlns:xs="http://www.w3.org/2001/XMLSchema">

    <xs:element name="data">
        <xs:complexType>
            <xs:sequence>

                <xs:element name="users">
                    <xs:complexType>
                        <xs:sequence>
                            <xs:element name="user" maxOccurs="unbounded">
                                <xs:complexType>
                                    <xs:sequence>
                                        <xs:element name="name" type="xs:string"/>
                                        <xs:element name="surname" type="xs:string"/>
                                        <xs:element name="skill" type="xs:string"/>
                                        <xs:element name="preferredCuisine" type="xs:string"/>
                                    </xs:sequence>
                                </xs:complexType>
                            </xs:element>
                        </xs:sequence>
                    </xs:complexType>
                </xs:element>

                <xs:element name="recipes">
                    <xs:complexType>
                        <xs:sequence>
                            <xs:element name="recipe" minOccurs="0" maxOccurs="unbounded">
                                <xs:complexType>
                                    <xs:sequence>
                                        <xs:element name="title" type="xs:string"/>
                                        <xs:element name="cuisines">
                                            <xs:complexType>
                                                <xs:sequence>
                                                    <xs:element name="cuisine" type="xs:string" minOccurs="2" maxOccurs="2"/>
                                                </xs:sequence>
                                            </xs:complexType>
                                        </xs:element>
                                        <xs:element name="difficulty">
                                            <xs:simpleType>
                                                <xs:restriction base="xs:string">
                                                    <xs:enumeration value="Beginner"/>
                                                    <xs:enumeration value="Intermediate"/>
                                                    <xs:enumeration value="Advanced"/>
                                                </xs:restriction>
                                            </xs:simpleType>
                                        </xs:element>
                                    </xs:sequence>
                                </xs:complexType>
                            </xs:element>
                        </xs:sequence>
                    </xs:complexType>
                </xs:element>

            </xs:sequence>
        </xs:complexType>
    </xs:element>
</xs:schema>